{
  "schema_version": "1.0.0",
  "snapshot_id": "pong-behavior-watch-wall-bounce-every-n-snapshot-01",
  "session_id": "pong-request-watch-every-n-001",
  "run_id": "pong-behavior-watch-wall-bounce-every-n-run-01",
  "scenario_id": "pong-behavior-watch-wall-bounce-every-n",
  "trigger": {
    "trigger_type": "manual",
    "requested_by": "behavior-watch-fixture",
    "reason": "manual_request",
    "frame": 24,
    "timestamp": "2026-04-14T00:31:00Z"
  },
  "root_scene": {
    "name": "Main",
    "path": "/root/Main"
  },
  "frame": 24,
  "captured_at": "2026-04-14T00:31:00Z",
  "node_count": 4,
  "nodes": [
    {
      "path": "/root/Main/Ball",
      "type": "CharacterBody2D",
      "parent_path": "/root/Main",
      "owner_path": "/root/Main",
      "groups": [],
      "script_class": "",
      "visibility_state": {
        "visible": true
      },
      "processing_state": {
        "process": true,
        "physics_process": true
      },
      "transform_state": {
        "position": [56, 64],
        "rotation": 0,
        "scale": [1, 1]
      },
      "properties": {
        "name": "Ball",
        "child_count": 0
      }
    }
  ],
  "capture_status": "complete"
}
